{
  "tenant_id": "tenant-acme",
  "finding_id": "01JFINDING0000000000000000",
  "finding_type": "network.flow_anomaly",
  "modality": "network",
  "asset_id": "asset-checkout-01",
  "service_id": "checkout",
  "site_id": "site-ewr",
  "model_name": "network-model",
  "calibrated_score": 0.86,
  "severity_hint": "high",
  "incident_id": "01JINCIDENT000000000000000",
  "mitre_tactics": ["Command and Control"],
  "mitre_techniques": ["T1071"],
  "contributor_types": ["new_external_peer", "beaconing_heuristic"],
  "observables": [{ "type": "ipv4", "value": "203.0.113.50" }],
  "summary_text": "New external peer with periodic egress from checkout",
  "occurred_at": "2026-07-27T14:02:11.000Z",
  "occurred_at_ts": 1785156131,
  "expires_at_ts": 1787748131,
  "embed_model": "cisco-ai/SecureBERT2.0-biencoder",
  "embed_version": "1",
  "schema_version": "1.0"
}
